Subject,Content
환경/공원/상수도,"안녕하세요?서울시정을 위해 항상 애쓰시는 여러분들께 늘 감사드립니다.다름아니라, 누구보다 일찍부터 업무시작으로 출근 시간때마다 만날 수 있는 미화원분들에 관한 건의사항입니다. 동네 골목 골목을 다니시며 궂은일도 마다않는 미화원분들께 늘 고마운 마음을 가지고서 청소차량으로 골목에서 출근길이 좀 막혀도 늘 기다렸다가 제차를 출발시키곤 합니다.그런데, 늘 생각하지만, 철소차량이 골목길 이곳 저곳을 돌다보면 우회전, 좌회전, 급정거 등 여러번 정차도 해야하는데 늘 차량 뒤에 올라타서 가시는 미화원분들을 볼때마다 뒤따라가는 차를 운전하는 사람 입장에서 늘 걱정이 됩니다. 미화원 대부분이 연령대가 있는 분들 위주로 구성되있던데 저러다 팔힘이 빠지거나, 순간적으로 차에서 떨어지면 어쩌나 걱정입니다.그러나, 골목길은 그나마 다행인것이 속도가 빠르지 않지만, 대로변에서는 속도 있게 달리는 청소차 뒤에도 여전히 미화원 분들이 안전장치 없이 탑승해서 가시는 모습을 보면서 걱정이 참 많지만 그렇다고 바쁜 출근길에 저행으로 따라갈 수도 없는 입장입니다.혹시나 모를 안전사고 예방으로 뒤따라오는 차량에 의한 2차 피해가 없어야겠다 생각해서 자가 운전자 입장에서 이렇게 글을 올리게 되었습니다.탑승을 차단하지 못하겠다면, 허리 높이의 안전대나 미화원 신체와 차량을 연결하는 안전고리 같은 안전장치만이라도 하는 것이 어떨까 합니다..묵묵히 일하시는 미화원분 입장에서 보면 위험하지만 어쩔 수 없이 탑승을 할 수밖에 없을지도 모릅니다. 하지만 또 그분들의 역할이고 업무이니 나무랄수 만은 없을 것 같아 민원에 올리니 꼭 참조 하시어 업무에 참조하여 주시기 바랍니다."
환경/공원/상수도,"2005년 경차를 구입해서 승용차 요일제를 계속 참여 했습니다.2015년 10년 넘게 승용차를 처분하고 경차를 새로 구매해서승용차 요일제를 신청하러 동사무소에 갔습니다.동사무소에서 승용차 요일제 참여 관련 서류를 작성하고전자태그 갱신 관련 안내장을 보니경차를 소유하고 있는 저에게 승용차 요일제의 다양한 혜택은무용지물입니다.경차이기에 자동차세도 많이 감면을 받고 있는 상황이고승용차 요일제를 하는 이유는교통난 해소와 환경오염 개선, 에너지 절약이 주요한 이유일 꺼 같은데대형차와는 달리 경차 소유자에게는 전혀 혜택이 없습니다.10년 넘게 승용차 요일제를 참여하고 국가 시책에 맞춰 에너지 절감에 노력을 하고자다시 경차를 구매했지만 대형차 위주의승용차 요일제 프로그램은 서울시의 보여주기 성 예산 낭비성 캠페인이라는 생각 뿐입니다.그래서 저는 더이상 승용차 요일제에 참여하지 않기로 합니다.이 승용차 요일제가 제대로 시행이 되기 위해서경차의 경우는 승용차 요일제에 참여하는 경우서울시의 모든 주차장에서 주차비 할인 50% 시행 했으면 합니다.이렇게 보여주기 성 행정과 같은,10여년이 넘도록 시행한 예산만 낭비하는 승용차 요일제 폐지 했으면 합니다."
기획/감사/교육/정보화/마을공동체,서울시 시설관리직 9급 공무원 시험 관련 질문입니다.혹시 답변을 할 수 없는 경우에는 그 이유를 알려 주시길 부탁 드려요.(시설관리직 9급 공무원 시험이 생긴 후 부터)1. 응시자들의 연령분포2. 합격자들의 연령분포
안전/소방/민방위,구입할 수 있는방법 가르쳐주세요. ^^
환경/공원/상수도,연일 강수량부족으로 걱정스러운 뉴스거리가많은 요즘 서울시에서는 시내 곳곳에새벽마다 시행되고있는 도로 물청소에 대해어떻게 생각하시는지요?어느순간부터 매일 새벽마다 엄청난 양의 물을도로에 뿌려가며 청소를 하시던데..그 엄청난 용수를 길바닥에 흘려가며얻는점은 무엇인지 정말 궁금합니다충분한 실효성이 있다면 응당 하셔야되는일이겠지만서도 제 짧은 생각에는지금같은시기에는 득보다 실이많을것으로생각되어 한자 적어봅니다
교통,"안녕하세요?월계지하보차도 부근에는 동부간선도로로 진입하는 곳과 하계역 사거리, 그리고 인덕대.광운대가 위치해 있고, 지하차도가 있음에 따라 길이 좁아지는 구간이기 때문에 출.퇴근에는 월계지하보차도가 거의 마비 수준입니다.또한 최근에는 출.퇴근 시간 외에도, 오전10시나 오후3시 등의 낮시간대까지 이 부근이 항상 밀리고 있습니다. 그리고 지하차도 위에 위치한 골목길에서는 불법주차가 많이 유발되어서 차들이 통행하기에 항상 불편하기 일쑤입니다.따라서 이곳이 상습정체 지역이고 각종 문제가 있기에, 정체를 해결한 만한 방안을 내놓겠습니다.우선 1호선을 지하차도 부근만 지하화 시키는 것입니다.지하차도가 월계역과 광운대역 두 역과의 거리가 어느정도 있기에 지하화 하는데 있어서는 큰 문제가 없다고 봅니다.다음으로 지하차도를 없앤 뒤, 차를 지상으로 다니게끔 해서 1호선과 월계로가 교차하는 지점에다가 차단기를 설치해 놓아서 건널목을 만드는 것입니다.이렇게 하면 길이 좁아지는 구간이 사라지기 때문에 정체현상이 많이 줄어들 것이고 월계지하보차도 부근 뿐만이 아니라 하계역 부근과 중랑천 위 다리가 위치한 곳 까지도 정체가 많이 줄 것이라고 봅니다.비록,현실성 없는 제안이여도 이 제안을 고려해주시면 감사하겠습니다."
환경/공원/상수도,"과천에 거주하는 과천시민입니다올해 서울대공원과 경기남부한살림과의 계약으로 텃밭을 분양받아 올 한해 텃밭을 일구어 왔습니다황무지나 다름없는 땅이었지요그곳을 열심히 일구어 비옥하게 바꾸었습니다지금 한창 김장을 위한 배추, 무우 등을 재배하고 있습니다한데 내년에는 텃밭을 이용할 수가 없겠다는 소식을 접하게 되었습니다들리는 소문에는 서울대공원의 전원장님이 진행한 텃밭이 현원장님으로 교체되며 더이상 의지가 없음을 밝혔다는 것인데정말로 그런 것이라면 시민을 위한 행정이 원장의 교체로 손바닥 뒤집듯이 쉽게 바뀔수 있는 것인지요?저희들은 앞으로의 꾸준한 텃밭이용을 황무지 개간과 같은 수준의 일도 마다않고 한 것인데 이제와서 서울대공원의 다른 용도로 사용한다고 다시 가져간다면 이와 같은 일방적인 횡포가 다시 없음을 만천하에 알려 적극적으로 저지할 것입니다이와 같은 일이 없도록 서울시 공무원 분들과 서울대공원의 직원분들께 간곡한 마음으로 말씀드립니다결과를 알려주시기를 부탁드립니다"
환경/공원/상수도,"서울시내를 걷다보면 어느 구청 관내를 불문하고 인도에 화단을 설치히고 있다.이런 화단의 설치목적은 도시환경개선이나 잡상인들을 맊기 위한 것도 있다.이러한 화단설치에 굳이 반대하지 않는다. 좋다. 그런데 그 다음이 문제다.이 넓은 서울, 천만이 사는 수도 서울에 얼마나 많은 화단이 만들어져있고또 얼마나 많은 돈들이 들어 갔는지는 나로서는 알수가 없다.천무학적인 예산을 들여 설치를 했으면 유지관리를 잘헤야한다. 그런데....화단의 나무는 죽어있고, 여른에는 잡초투성이고, 테두리는 부서져 있고.거기다가 모든 화단은 한마디로 쓰레기장이다.옆에 쓰레기통이 있어도 쓰레기라고 생각되는 모든 쓰레기로 보기 좋다?만들었으면 유지보수를 잘해야한다. 그것을 못하겠으면, 만들기만하고 말것이면처음부터 만들지나 말던지...사후관리에 대한 대책과 조속한시일내에 시정을 바란다."
안전/소방/민방위,매일 자유로에서 서부간선도로로 출퇴근 하는 시민입니다.성산대교로 빠지는 길목에 있는 표지판에성산대교의 영문표기가 잘못되어있는것을 매번 보면서 지나가는데(첨부파일 보시면 seongsan 이 senogsan 으로 쓰여있는게 보입니다.)어찌보면 별거 아닌거지만그냥 직업병인지 신경이 자꾸 쓰이네요.도로표지판 글씨하나 바꾸는게쉽지 않은 일이라는건 압니다.도로통제도 해야되고 스카이도 써야되고초고휘도반사시트 커팅도 하고 어쩌고 저쩌고..어쨌든 민원을 넣으니 처리는 해주실거 같은데과연 그걸 바꾸는게 맞는지 어떤지는 제 스스로도 의문이 가긴 하네요. ^^
교통,@seoul_eds 9호선 급행은 출퇴근때 콩나물시루같습니다 여전히 냉방이 필요한데 그렇지 않네요 실내외 온도차로 두꺼운옷차림에 빽빽한 사람들의 체온까지! 너무 더운 출퇴근 길입니다
주택/도시계획/부동산,"현상설계공모의 심사제도에 대한 개선 요청합니다.(서울시 및 관련 지자체를 대상으로 위의 사항을 검토해서 바람직한 절충점을 찾아서, 공정거래 및 질 높은 공공건축물들이 지어지고, 도시환경이 개선되고, 살기좋은 도시 서울로 나아갔으면 합니다. )아울러 아래의 현황 및 제안의 근거는 제가 참여한 현상설계에 기인한 것이 아니고, 그 과정에서 알게 된 현상설계공모에 대한 문제점들을 앞으로 개선해 나가야 겠다는 취지에서 업계에 만연한 말들을 기준으로 개선을 요구하는 것입니다. 직접적인 사례는 없고, 간접적으로 듣거나, 심사위원용으로 책상에 두고간 랜더된 카달로그를 개인적으로 목격한 사례를 바탕으로 합니다. 미래를 위한 관행적으로 잘못된 행위를 해오던 것을 제도적으로 개선하자는 취지입니다.서울시 발주 공공건축물 현상설계공모에 참여했습니다.비공개로 심사일 당일, 심사위원들 앞에서 5분간 발표하는 것으로 되어 있습니다.행정절차 상의 비공개 원칙 등은 잘 이루어지고 있습니다. 매우 만족스러웠습니다.하지만, 1달반에서 두달을 건축물 설계에 매진해서 제출한 결과물을심사위원들이 공모 참여자들의 5분간의 발표로 각 건축물 디자인의 결과물의 장단점 및 심사점수를 매긴다는 것은 불가능하다고 생각합니다.첫째로, 5분의 설계공모 참여자의 발표시간에 심사까지 이루어지는 현행 심사제도는 문제가 많습니다. 최소한 15분20분의 길이로 제출된 안의 고려사항들을 참가자가 세세하게 설명할 수 있는 시간이 주어져야 합니다. 아울러 심사위원들도 세세하게 제출된 안을 검토할 수 있는 시간이 주어져야 합니다.<= 5분의 짧은 발표 및 심사시간으로 인하여, 현재 비공개임에도 불구하고, 미리 공개된 심사위원들을 찾아가서 제출안을 설명해야만 한다는 것이 공공연한 사실입니다. 미리 찾아가서, 과다경쟁을 막기위해서 지침으로 제한 한, 포토샵 등을 사용한 랜더링된 3차원이미지 등을 카달로그로 만들어서 보여주는 것이 현 실정입니다. 제가 참여한 현상설계에서 그러한 일이 있었다는 것은 아니고, 현황이 그렇다는 것입니다.주변의 아는 교수님들은 무조건 찾아가야 한다는 말을 합니다. 실제로 제가 아는 교수님은 전화로 먼저 연락하고 찾아온다고 하는데, 오지말라고 하기가 힘들다고 말합니다. 그렇게 찾아와서 설명하는 것이 점수에 영향을 미치지는 않는다고 합니다. 하지만, 그 제출안을 좀 더 이해할 수 있는 것은 사실입니다. 미리 찾아가야만 제대로 설명이라도 할 수 있다는 말입니다.비공개로 교수님들께 설문조사를 통해 제도개선의 방향을 정해야 한다고 생각합니다.교수님들도 불편하고, 찾아가는 사람들도 불편한 상황입니다. 이유는 불충분한 설명시간에서 출발합니다. 비공개의 원칙을 깬 업체들에게도 부정이 아닌 억울하다고 할 이유가 있습니다. 서로 공정하고 떳떳할 수 있도록 심사제도가 개선되어야 합니다.5분이라는 짧은 시간은, 비공개의 원칙을 깨고 참여업체들이 부정을 저지르도록 만듭니다. 5분은 절대 2달을 공들여 만든 설계안을 세세하게 설명할 수 있는 시간이 아니고, 심사하는 분들 역시 제대로 각 설계안을 살필 시간적 여유가 아닙니다. 비공개의 원칙을 파행적으로 운영되게 만드는 심사시간입니다.아울러 80억이상의 공사비가 드는 현상설계안을 10개팀이라고 하면 1시간1시간30분이라는 시간에 심사를 한다는 것은 집행하는 예산에 비해서 너무 적은 시간과 노력을 들이고 결과를 판단하는 것입니다. 제대로 된 안을 선정할 충분한 시간을 심사위원들께 주어야 합니다. 그와 함께 심사위원단을 건축물의 명판에 넣어서 무한책임과 자부심을 갖도록 해주어야 합니다.비공개를 규칙으로 만들었으면, 실제로 그렇게 운영될 수 있도록 제출안을 설명할 시간을 마련해줘야 합니다. 시간이 문제라면, 심사위원회로 선출된 1차를 통과한 제안들만, 충분한 발표 및 설명을 할 수 있게 하는 것도 방안입니다.비공개를 지키는 참여자가 상대적으로 불이익을 받는 심사제도는 개선되어야 합니다.2. 비공개 원칙을 어긴 경우에 대해서 어떠한 제재나 제한이 있는지 모르겠습니다. 현 공모지침에 구체적인 제재사항을 적어서 알려야 합니다.비공개 원칙을 어기는 경우는 해당소속기관의 장에게 공문을 보내고,향후 35년간 현상참여 및 심사 참여가 제한되는 등의 제재사항을 명기하고 명단을 건축관련 협회 및 해당 지자체에 공개해야 합니다.아울러, 해당 공공건축물이 준공되어 준공기판을 제작하고, 건축물 관련 정보를 작성 배포할 시에 해당 심사위원들의 이름을 명시해서 자부심을 갖고 좋은 건축물을 심사,선정할 수 있도록 해야 합니다. 아울러 서울시내에서 지어지는 모든 종류의 공공발주 건축물들의 정보를 보여주는 웹사이트를 만들어서, 신축된 공공건축물의 건축사, 발주처, 시공사, 심사위원들 등의 관련 정보 및 사진이미지 등을 홍보 및 공개하여 심사를 의미있고 책임감이 필요한 행위로 만들어야 합니다.3. 공공건축물의 디자인이 중요하고 이를 통해서 도시의 생활환경을 개선하고 국가 혹은 도시경쟁력으로 확대시키려고 하고 있다. 심사위원 선정도 최근 5년 내에 실제적으로 좋은 건축물을 설계한 경력이 있는 분들을 위주로 될 수 있도록 해서, 과거의 효율 및 기능적 건축물만 평가할 수 있는 분들은 앞으로 심사에서 퇴출되어야 공공건축물의 질이 좋아질 수 있습니다."
문화/관광/체육/디자인,올림픽수영장이나 다른 구청의 체육시설들은 일요일 자유수영개장을 하여 시민들이 자유롭게 이용을 하고 있는데 왜! 잠실수영장만 일요일마다 휴관인지 이해가 안가네요.거기다 국가 공휴일마다 다 휴관인데 시민들을 위한 체육시설인지 아니면 공무원 근무 위주로의 시설관리를 하는건지 개선을 요구 합니다.이전에도 이런문제로 요구하였지만 개선의 의지가 없어 다시 의견을 제시 합니다.사설시설도 아니고 국민의 세금으로 건설된 시설을 국민이 이용하기 편하게 해 주십시요.일요일 수영장 개장은 직장인들과 지역 생활체육을 위해 필요하다고 생각합니다.빠른 개선을 요구 합니다.일교착 심한 계절에 감기 조심하시고 행복한 하루 보내세요.
여성/보육/아동 청소년,"안녕하세요○살 아들을 둔 맞벌이 부부 서울시민입니다.현재 민간 어린이집에 등원 시키고 있습니다.집근처 국공립어린이집에서 아이 발바닥을 바늘로 찔렀던 사고를 뉴스에서 본 적이 있어 국공립 또는 구립어린이집은 월급원장님들이 운영하시는 곳 또는 위탁운영되는 곳이라서 민간어린이집보다 딱히 메리트가 있다고 생각하지 않습니다.(민간어린이집이든 국공립이든 상관없다는 뜻입니다)현재 누리과정 예산이 부족해서 서울시교육청에서 예산편성에 어려움이 있다는 뉴스를 본적이 있어 학부모들이 불안해 하지 않을 수 없었습니다.그런데 국공립 어린이집 증설할 예산은 있나봅니다.서울시의 교통비가 오름에 따라 출퇴근 교통비가 늘어 항상 예산이 부족한 서울시정이 궁금했습니다.저출산 문제로 앞으로 등원할 아이들의 인원은 줄어들고 있습니다. 순조롭게 운영되어야 할 현존하는 어린이집들에 대한 지원이 넉넉치 않은것으로 알고 있습니다.민간 어린이집에 대한 규제가 심하여 개인비용으로 투자를 해온 시설장들은 손해 생기는 경우도 발생하여 불법을 행하는 사례도 있다고 합니다.과도한 규제와 페이퍼 업무, 부족한 지원, 저출산 등의 현존하는 문제의 해결을 뒤로한채 국공립 증설에 예산을 투자하신다는게 학부모의 입장으로서 잘 이해가 되지 않습니다.맞벌이 부부로서 어린이집은 필수요소입니다. 유치원은 하교시간이 일러서 선택의 여지도 없습니다. 자녀를 가진 맞벌이 가정에 가장 중요한 부분을 차지하는 어린이집문제. 면밀한 검토와 적절한 예산쓰임이 필요하다고 생각합니다.답변 부탁 드립니다."
건강/식품위생,노숙하는것까지는 이젠 익숙하니 상관없는데오줌싸고 역 내에서 담배피고 2에서 3번출구 사이에 내부에 있는 콘센트에 충전하면서 지나가는데 불편을줍니다.못쫒아내신다면 흡연이라도 못하게 해주세요..
주택/도시계획/부동산,국유지 위 동일 지번에 소유주가 다른 불법무허가 건물이 2동있는데 한동은 건축대장양식에 정식 등재되었으나 소유주가 다른 한건물은 건축대장양식과 기존무허가건물관리대장에 등재되지 않은 상황입니다.1. 나머지 불법무허가 건물은 1981년 ○○월 ○○일 이전에 지어졌다고 인지 하고 있습니다만 1981년 이전 지어졌다는 확실한 자료를 구비하지 않고도 구청에서 이전 건축물 이라는 인지 하에서 기존무허가건물대장 등재하지 않은 상태로 기존무허가건물 관리대상으로 관리할수 있는 근거법이 있습니까? 불법무허가건물 실소유주가 누구인지 모르는 상태입니다.2. 위와 같은 사유의 불법무허가건물을 규제하는 행정처리는 어떻게 됩니까?
교통,"안녕하십세요?저는 내년 위례신도시 하남지역 입주 예정자이자, 현재는 수원에 거주중이지만 서울시에 건의하고 싶은 사안이 있어 글을 올립니다.내년 입주 후 교통 상황이 걱정되어 하남시 교통행정과에 문의를 해보니하남시에서 위례신도시 서울지역 버스 노선인 333, 3012, 352, 440번 버스 노선의 하남지역 경유에 대해 변경 요청을 드렸고 이에 대해 서울시에서 해당 지역 주민들에게 의견 회신을 받는 중임을 알게 되었습니다.기존 입주민 들이야 당연히 안그래도 버스밖에 없는 지역인데 타권역 (그래봤자 1~2분 거리의 바로 옆동네이지만...)까지 경유한다는데 좋아하실 분이 없으리라 생각합니다.하지만 위례신도시는 서울, 성남, 하남이 도로 하나를 두고 행정구역이 분리되어 있기에 해당 지역 주민들의 편의만 생각해 근시안적인 행정처리를 하게 된다면 지역적 발전이 더디게 이루어져 결국 위례신도시 전체가 발전할 수 없으리라 생각합니다.하남지역 주민이라고만 생각 마시고 위례신도시 전체 입주민을 위해서 기존 버스 노선의 하남 지역 경유를 긍정적으로 검토해주시고, 서울 지역 분들도 분명히 하남 위례 성남 위례 지역을 가셔야 할 경우가 빈번하실 텐데 서울 시민의 불편이 없도록 증편도 적극적으로 고려해주시길 부탁 드리겠습니다.또한 추후 신설될 하남, 성남의 버스들의 서울 복정역 경유에 문제가 없도록 행정 조치 하시어 복정역을 이용하는 모든 시민들의 교통 편리도증대해 주시기 바랍니다.경계를 둔 타 도시가 되어버린 상황이지만 내집을 장만해 들어 가는데 버스가 없다고 생각하니 막막합니다.좋은 결과를 기대하겠습니다.감사합니다."
여성/보육/아동 청소년,"안녕하세요 서울 ○○구에 사는 주민입니다서울시에서 현재 운영중인 '서울시 여성안심택배'를 이용하고 싶은데 사이트에 자세한 정보가 없어 불편을 겪고 있습니다http://woman.seoul.go.kr/archives/41453좀 더 자세한 이용방법이 사이트에 정식으로 게재되었으면 하고또 하나 질문드리고 싶은 것은 해외에서 오는 택배, 예를 들면 편지와 같은 국제 택배도 수령 가능합니까?읽어주셔서 감사합니다^^"
안전/소방/민방위,저는 서울시 종로구 ○○동 ○○아파트에 살고 서울역을 통해 ○○시로 출근하고 있습니다. 이전에 의주로 지하차도를 없애서 교통혼잡이 가중되어 출근시간을 땡기는 것 까진 참았는 데 난데없이 서대문 고가도로를 없애서 교통이 너무 막혀 도저히 제 시간에 출근할 수없어서 시청 쪽으로 출근하여 출근 시간을 더 땡겼습니다. 누가 생각해도 고가도로를 없애면 교통이 막힐 텐데 무슨 생각으로 대체 시민의 의견을 듣기라도 하고 없앤 건가요? 특히 정부종합청사 뒤 지역에 사는 주민은 각종 세종문화회관 앞 광장의 집회로 교통이 통제되서 불편을 겪고 있는 데 지금까지는 교통이 통제되면 신문로를 통해 서대문 서울역 쪽으로 간신히 우회했는 데 이제 이것도 불가능하게 되었습니다. 이렇게 불편을 겪게 하였으면 세금을 깍아 주든지 세종문화회관 앞 광장에서 집회를 줄여 주던가 어떤 보상이나 대책을 마련해 주셔야 하는 데 오히려 서울역 앞 고가도로 마저 폐쇄한다하니 대체 무슨 생각으로 이지역 사는 사람을 옥 죄려 하는 겁니까? 책임있고 상식적인 대책 없이 계속 진행하려 한다면 우리 지역 사람들도 가만히 갇혀 있슬 수 만은 없잖겠습니까? 대책을 마련해 주세요
문화/관광/체육/디자인,오토바이 타고 다니면서 명함사이즈의 일수 대출 전단지 투척하는 행위!!심지어 오토바이 번호판도 안달고 다닙니다!! 이게 젤 위험해 보임!!골목골목 다니면서 전단지 뿌리는데 왜 이런건 단속을 안합니까??가게 문앞에 던져놔서 손님들 가게 들어올때 밟으면 미끄러울수도 있고 그거 치우는것도 번거롭고!!불법전단지 좀 제발 없애주세요!!!
환경/공원/상수도,서울시 ○○구 사는 시민입니다 옆집에서 개를 기르고 있는데 냄새와 소음 때문에 미칠거 같습니다 아파트 관리실 구청 경찰 이웃사이 환경분쟁조정위원회 다 연락해봐도 옆집이라 해당이 안된다 법적인 효력은 없다이런 대답만 듣네요
교통,"시에서 운영하고있는 자전거 우선도로 운영구간질문자전거우선도로 에서 자전거 운행중 차량과 사고가 발생하면 전적으로 자동차가 책임지는지에 대해 궁금합니다또 우측 끝차로는 자전거 통행가능""이라고 안내판에 써있는데 이것은 기존에도 자전거는 끝차선을 이용할수 있는것으로 아는데 뭐가 바뀐것인지 궁금합니다기존 질의한 내용입니다 답변이 완료됐다고 문자를 받았으나 응답소 탈퇴로 확인 불가능하여 다시 질의하는 내용입니다"
