Subject,Content
교통,"화랑로에 설치되어있는 ""버스전용차로 무인카메라"" 삼육대앞 서울방향 관련 입니다.민원1.무인카메라가 있기 전, 마지막 신호등의 3차선은 버스차선이아닙니다.""버스차선 표시 또한 되어있지않습니다""진입하는 곳 또한 몇달째 공사로인하여 2차선으로 좁아졌다가 신호등앞에서 다시 3차선으로 나누어집니다.민원내용은 마지막신호등을 기준으로 3차선에서 신호대기 후 ""정상적인 출발""을 했을경우 무인카메라가 있는 위치 이전에 차선변경을 원활하게 가능한가 하는 부분입니다.버스전용차로를 이용하는 무분별한 운전자를 처벌하는취지는 이해하겠으나 카메라 단속 위치가 마지막신호등 위치와 매우가까워 ""버스전용차로 침범""관련 ""과태료"" 를 물지않으려면 영화에나 나올법한 과속운전,안전불감운전등 교통사고를 동반하는 위험을 감수해야합니다.삼육대 앞 무인카메라 즉 화랑로 라인이 교통사고도 잦은곳이며 , 사망사고또한 사례가 있음으로 알고있는데 어찌하여 이런부분을 알고있음에도 조치가 취해지지 않은것인가요.신호등에 버스차선이라고 색깔을 칠하는 방법이나혹은 무인카메라 위치를 뒤쪽으로 옴긴다거나 하는 방법이 있음에도 개선조치가 이루어지지는 않고 사고만 유발하고있습니다.또한 이로인하여 과태료를 물어야하는 일반운전자는 얼마나 더 억울해야 ""개선""이 될까요.* 반드시 개선조치가 이루어져야 할 사항이나 해당부서는 전화조차 받질않습니다 *민원2 .과태료납부고지서에 있는 02)21334570~3 이 부서는 운영하지않는건가요?운영하지않으면 대체 왜 ? 전화번호는 기입하는건가 궁금합니다.오전부터 저녁까지 통화내역서상으로 20통이상 전화걸었음에도 연결한번 되지않았습니다."
환경/공원/상수도,"남산의 남측 산책로에는 천연가스버스가 운행됩니다. 그러나 관광버스들은 모두 경유차량 입니다. 오르막을 올라가면서 얼마나 연소가스를 뿜어내는지...산책로라는 말이 무색할 지경입니다. 시내버스 천연가스 운행이 무슨 소용있나 싶습니다. 한동안은 관광버스가 남산타워 아래 버스정류장에 주차되어서 관광객들 올때까지 공회전하고, 주차난을 일으키더니..언젠가 부터는 관광객을 부리고 나서 다시 내려갔다가, 다시 실으러 올라오는것 처럼 보입니다....주차난때문으로 사료됩니다.그러나, 그로인해 산책로에 가뜩이나 많은 관광버스 운행횟수를 두배로 늘리는 결과를 초래했습니다...걷는사람들은 불쾌해서 숨쉴수도 없습니다. 나무들은 둘째고...올라갈때 힘들어서 관광객을 실어나른다면..내려갈때는 남산도서관 쪽으로 걸어내려가게 해야 하지 않을까요..남산 곤도라 설치되면 관광버스 운행 금지 시킨다는 서울시 방침을 접하고 다행이다 싶었습니다만...그전에라도 조치를 취해야 할것 같습니다. 남산이 시민을 위한것이지 관광회사를 위해 존재 하지는 않으니까요.. 관광을 가보면 걸으면서 느낀것이 기억에 훨씬 오래 남습니다. 경치도 분위기도 느낄수 있으니까요..관광버스 운행을 당장 멈추기 어렵더라도..두번씩 왕복하는것은 막아주세요.오늘짜 ○○○뉴스 기사를 첨부합니다.http://news.○○○○○.com/main/ranking/read.nhn?mid=etc&sid1=111&rankingType=popular_day&oid=047&aid=0002116795&date=20160525&type=1&rankingSeq=1&rankingSectionId=103"
복지/어르신/장애인,노숙인이 많습니다.이들은 마땅히 씻을 곳도 없어 자기정비가 되지않아 노숙인의 위생관리는 물론 주변행인과 관광객들에도 보기에 불편합니다.따라서 노숙인 전용 위생관리소를 운영하여몸을 씻고간단한 빨래도 할 수 있도록 준비해주면 좋겠습니다.부디 검토하시고 좋은 결정이 있기를 바랍니다.
경제/일자리,"현재 가락시장의 개선공사가 한창입니다.가락몰, 쇼핑센터,도서관,식당,병원,등등의 편의시설이 생기고 있습니다.참 고무적인 일입니다.제안하고 싶은 것은가락시장에 실내체육관을 설치하여 송파구의 절대적으로 부족한 체육시설을 확충을 해주셧으면 합니다..가락시장이 개선을 하면서 주민들의 지적생활을 위하여 도서관을 설립한것은 참으로 고무적이지만 생활체육으로 주민들의 체력 또한 못지않게 중요한데계획에 보면 실내체육관은 없는 것 같아서 제안을 합니다...아울러게다가 최근 운동시설사용현황을 보면 타 운동보다는 전년령에 걸쳐서 동호인들이 폭발적인 증가세에 있는 배드민턴전용구장으로 생겼으면 합니다...기존 장지동에 전용구장이 하나가 있지만 시설이 완전히 포화되어 거의 제기능을 못할 때가 종종 생깁니다...꼭 실내체육관...게다가 배드민턴 전용구장으로 생겼으면 하는 마음 간절합니다..."
교통,잠실방향 장지역 가든파이브 버스정류장이 매우 혼잡합니다.정류장 위치 또는 구조 때문인지? 정류장 앞 뒤 신호체계가안맞는지 다른 정류장에 비해 진입 진출이 몇배나 더 걸립니다.특히 러시아워에는 거의 5분정도...대중교통 이용 활성화를 위해 원인을 분석해서 해결책을 마련해주시면 감사하겠습니다.
교통,"서울시의 2010년 경복궁서측지구단위계획 수립의 중심 정책이 서촌지역 보전입니다. 당시 필운대로 역사가로 조성을 위해 지중화 사업과 보행로 개선을 계획하였습니다. 사실 1999년 개설된 필운대로는 역사가로로 명명되기에 부적합한 측면이 있습니다. 조선시대 부터 이어져 오는 동네의 골목길과 물길을 횡으로 자르고 만들어진 길을 역사가로로 명명하는 것 자체가 불합리하지만, 주민들을 위한 보행로 개선의 의미로 생각했습니다. 하지만 최근 종로구청장은 필운대로 지하2층 규모의 주차장 공사를 발주하였습니다. 이를 아는 주민들은 거의없고, 용역이 발주되면서 알게되었습니다. 요즘 측량을 하고 있더군요.서촌에 주차장이 부족한 것은 어제 오늘의 일이 아닙니다. 갑자기 주민들의 주차 수요가 늘어났나요? 불편하지만 그런데로 적응하면 살고 있습니다. 지상주차 100대 정도를 지하에 넣고, 이왕 파는김에 173대를 늘리기 위해, 지하2층까지 주차장을 만들겠다는게 종로구청장의 생각입니다. 필운대로는 폭15m를 넘나드는 규모의 도로입니다. 과연 이 주차장이 주민을 위한 수요를 고려한 것일까 의심하는 주민이 늘어가고 있습니다.먼저, 땅을 파서 주차장을 만드는 쉬운 방법을 선택하기 전에, 얼마나 서촌의 주차문제 해결을 위해 고민했는지 의심스럽습니다. 최근 다양해 지고 있는 첨단의 주차관리 시스템을 도입하고, 소규모 민자 주차장 유도 정책, 공유자동차 이용 증진을 위한 방안마련, 공공자전거 이용 편의 증진을 위한 지역 교통허브 설치등 먼저 고민해봐야 할 일이 있지 않습니까? 이러한 분석을 통해 얼마 만큼의 주차수요를 대응할수 있는지 판단한 후, 주민들의 공감을 얻어 땅파는 사업을 해도 해야하는 것 아닌가요? 서촌의 보전정책에 반하는 공공의 지역 관광지 촉진 정책으로 밖에 보이지 않습니다. 서촌을 지켜야 한다고 생각하신다면, 꼭 챙겨봐 주시기를 부탁드립니다.서울이라는 거대 도시에, 조금 불편하고, 낡았지만 살기좋은 동네로서 서촌 같은곳 하나쯤 남겨 두어야 하는것 아닐까요?"
여성/보육/아동 청소년,맞춤보육 서비스 내용 전달받았습니다.너무 화가 납니다. 보육은 누구에게나 평등해야한다고 생각합니다.특히나 누리과정 지원된다고 했다가 지금은 일부 자기부담을 하게 하더니 맟춤보육이라는 명목으로 나머지 시간은 자기부담으로 하라는 식은 엉터리 아닌가요? 저는 현재 맞벌이 부부라 지금 시행건에 큰 해당은 없지만 앞으로 저희 가정에도 일어날 수 있는 충분한 건이기 때문에민원제기합니다.또한 매년 출산감소로 다자녀 지원한다하고 다자녀 출산 장려한다고 하면서 어린이집 보육에 누구에게나 공평한 지원이 아닌 자기부담하라는건 이치에 맞지않는 처사입니다.맞춤 보육시행으로 교사 월급 삭감또한 아이들에게 2차 피해로 돌아올 수 밖에 없는 처사가 될것입니다.기존에도 어린이집의 열악한 환경과 지원이 원만하지 않아 여러가지 고충이 있다고 알고 있습니다. 선생님이 안정됨과 기쁨충만해야 아이들에게도 더많은 혜택이 이루어 지는것은 당연합니다.직장맘이자 아이엄마로서 정부예산 부족하다고 할때마다 어린이집이 먼저 타격을 받게되니 정말 침울합니다.가장 기초가 되고 기본이 되는 보육에서 절감하지 마시고 당신들의 자녀가 있다고 생각하시고 다시한번 시정해 주셨음 합니다.
기획/감사/교육/정보화/마을공동체,"안녕하세요. 인천에 거주하는 대학생입니다.서울시청 홈페이지에 나와있는 2013년도 서울시 재무보고서에 명확히 표시되지 않아 있어서 묻습니다.다름이 아니라 서울시의 2013년, 2012년도유지관리비용을 알고싶은데요.일반 기업회계에서 명시되는 유지관리비의 정의와서울시 회계에서 명시하는 유지관리비와 같은지 묻고싶습니다.또한 서울시 회계에서 명시하고 있는 유지관리비에 속하는 자산들은어떤것들이 있나요?"
문화/관광/체육/디자인,"안녕하세요?서울시에서 중장기적으로 경희궁, 돈의문 복원을 계획 중인 것으로 알고 있습니다.최근 서울시에서 추진중인 돈의문 박물관 마을 조성지가 돈의문, 경희궁 복원 자리와 겹치는 듯한데, 향후 경희궁, 돈의문 복원시에 또 박물관을 다시 헐어야 하는 등의 불필요한 비용이 들어가는 것이 아닌지요?돈의문 박물관 마을 조성부터 경희궁 복원, 돈의문 복원까지 전체 년도별 상세 plan과 지도상의 정확한 위치를 알고 싶습니다.경희궁복원이나 돈의문 복원이 최우선일 듯한데 굳이 박물관 건립을 추진하는 이유가 있나요? 예산의 중복낭비 없이 경희궁, 돈의문 복원을 한꺼번에 추진하는 방안을 왜 검토 안하시죠?"
안전/소방/민방위,"2016년 05월 ○○일 ○○역 ○번출구 앞에 소세지 등을 판매하는 음식점 콘테이너가 생겼습니다.○○구청 도시계획과에 전화하여 물어보니 ○○에 있던것을 설치했다고 합니다. 이에 제가 철거를 요청하니 철거할 수 없다고 합니다. 이에 민원을 제기합니다.첫번째, 설치 결재자가 ○○구청 도시계획과 과장전결이라고 하는데 이렇게 중요한 것을 과장전결로 진행하는 것이 맞는지 확인하여 주시기 바랍니다.두번째, ○○지역에 있던것을 ○○주변에 설치하지 않고 왜 ○○지역에 설치하여 주변환경을 훼손하는지 이해가 안 됩니다. 조속히 철거를 요청합니다. 제가 05월 ○○일에 도시계획국장과 통화를 하여 7일 이내에 철거를 하지않으면 철거할 수 있도록 조치를 한다고 말씀을 드렸는데 05월 ○○일 현재 철거가 안된 상태입니다.하루빨리 철거를 하여 깨끗한 환경을 유지하는데 불편함이 없도록 하여 주시기 바랍니다. 끝."
환경/공원/상수도,"안녕하세요?저는 과천에 거주중인 시민입니다.서울시에서 소유한 과천서울대공원의 운영에 대해서 말씀드리고자 합니다.현재 과천서울대공원의 입장료에는 다둥이행복카드 소지자에 대하여 할인을 적용하고 있습니다. 저 또한 다둥이 아빠로서 과천시에서 발급한 다둥이카드를 사용중에 있는데, 과천에 위차한 과천서울대공원 또한 당연히 적용될 줄 알고 매표소에서 제시하였다가 거절당하고 말았습니다.과천서울대공원은 서울시 소유이기때문에 서울 다둥이에게만 할인이 적용된다는 것이 이유였습니다.할인 대상을 서울시민에게만 적용한다는게 불합리하지는 않겠지만, 경기도 과천에 위치한 과천서울대공원에서 지역민을, 그것도 같은 다둥이 가족임에도 불구하고 서울시민과 분리하여 할인에서 배제시킨다는 점은 분명 기분좋지 않는 일일 것입니다.요즘 과천서울랜드에서는 과천시민을 대상으로 연간회원권 할인을 하고 있습니다. 저 또한 3년째 연간회원권을 구입하여 가족과 함께 이용 중입니다.이번 민원을 통하여 과천서울대공원 또한 다둥이카드 할인을 서울시민 뿐만 아니라 과천시민들에게도 혜택을 주셨으면 합니다.감사합니다."
환경/공원/상수도,미세먼지에대한 서울시만의 대책이 있으신가요?
환경/공원/상수도,"벌써 경의선숲길공원에 대한 민원만 3번을 쓰는데 1년전이나 지금이나 개선된점이 하나도 없네요. 소음, 쓰레기, 공원안에서 발생하는 금지행위에 대한 단속 하나도 관리라는게 없네요.소음저녁시간때만되면 소음이 시작됩니다. 마이크와 우퍼를 가지고 소음을 만드는 일이 빈번하게 발생하나 구청에 민원을 넣어도 업무시간이아니라서, 당직근무하는 사람이없어서 라는 이유때문에 주민들은 소음에 시달립니다.쓰레기최근들어 사람들이 많이 찾고 상점들도 많이 생겨 쓰레기가 많이 생겼습니다. 그러니 홍대입구역부터 가좌역까지 쓰레기통이 하나도 없습니다. 이민원은 저번에도 넣었는데 주민들생활쓰레기 때문에 안된다고 하셨는데 주민들 쓰레기버리는곳 따로있습니다. 공원내에 쓰레기통이 생겼으면 합니다.단속공원내에 야영, 상업적행위는 금지되어있는 걸로 알고있습니다. 하지만 오늘도 의류를 공원안에서 판매하는것을 보았고 금지되는 행위에 대한 단속을 보지 못하였습니다. 이에 대한 신고를 하고싶지만 어차피 업무시간이아니라서, 당직근무하는 사람이없어서 라는 답변이 올게 뻔해 보고도 못본척합니다.이전에 두번의 민원에 대한 답변이 똑같이 (더욱더 지속적인 단속을 실시하여 공원의 질서확립 및 수준 높은 공원이용 문화 정착을 위해 노력하도록 하겠습니다.) 라는 답변뿐 변한것은 하나도 없고 정확한 답변도 아닙니다.계속 이러한일이 발생할텐데 말로만 단속,개선,노력 글만쓰시고 실제는 변한것이 없고 오히려 사람이 많아져 더욱 문제가 많이 발생합니다.문제에 대한 정확한 답변과 해결방안 답해주세요. 그리고 오후6시 이후에 공원에 민원이생기면 신고가능한 번호 알고싶습니다."
환경/공원/상수도,"작년부터 청계천에 자주 산책을 다니는 시민입니다. 하지만 여름이 다가와서인지 올해들어 날파리가 숨을 쉬기 힘들 정도로 많아서 불편합니다.한 두 마리가 아니라 떼거지로 눈 내리듯 가는 곳마다 있어서 마스크를 끼지 않고서는 지나다닐 수 없고 마스크를 꼈는데도 그 외에 눈이나 이마, 머리카락에 붙어있을 정도입니다.청계천으로 출퇴근 하는 시민들, 놀러나온 가족 등 모두 얼굴을 찡그리고 옷소매로 코와 입을 가리지 않고는 다닐 수 없는 상황입니다. 모두들 한마디씩 하더군요 날파리가 왜이리 많냐, 방역을 제대로 하는 거냐, 숨쉬기 힘들다. 서울시에서 제대로 방역을 하는건지 여쭙고 싶습니다. 직접 방문하시고 사태의 심각성을 꼭 알아주셨으면 좋겠습니다. 숨을 쉴수 없을 정도로 많은 날파리의 숫자를 줄여주면 좋겠다는 바람입니다. 청계천을 자주 가는 시민으로서 부탁드리는 바입니다."
교통,"오늘 강남역 사건 이후의 서울시 방침에 대한 기사를 보았습니다.언제까지 서울시는 사건 발생 후, 조치에 대한 의견만 있으시죠?제가 사는 ○○구 ○동의 이면도로에는 항상 불법주차가 판을 칩니다.이 부분에 대해서 구청에도 민원을 제기하고...담당 공무원들은 차들이 모두 빠져나간 주간에 나와서민원이 해결되었다는 말도 안되는 문자나 보내고...오죽 답답했으면, 지나가는 주차단속 차량을 붙잡고 물었습니다.이면도로도 단속 좀 하시라고..이에 이런 대답을 하시더군요.서울시에서 주차공간이 부족하니 이면도로에 대한 단속을 자제하라고..시장님께 묻겠습니다.만약 이면도로에 화재가 발생하고, 불법주차된 차량들로 인해 소방차의 진입이 어려워화재에 대해 대처하지 못하면, 그때 조치를 해주실건가요?왜..항상 눈에 보이고 예상되는 문제에 대해서는 현재의 환경에 대한 핑계만 되는거죠?혹시 시장님이 살고 계신 그곳에도 불법주차가 만연한가요?이 질문은 ○○구청장님께도 해야겠군요..제발 이제는 소 잃고 외양간은 그만 고쳤으면 합니다."
경제/일자리,공정하게 선별할지도 의문입니다.퍼주기식이라고 밖에는 이해가 안됩니다.청년수당이 아닌 다른 방법으로 청년들을 사회에 참여시키며 취업을 도울수 있는 방법이 여러방법이 있을텐데요.예를 들어 어느 직종의 취업을 희망하는지 취업을 희망하는 업체가 있는지 신청을 받아 관련직종이나 그 관련회사와 서울시가 연계하여 그 청년이 파트타임 아르바이트를 하여 서울시가 아르바이트 비용을 대준다면 오히려 더 효과적으로취업을 희망하는 청년에게 도움이 되지 않을까요??청년수당은 실질적으로 도움이 되는 청년은 몇프로 안될 것으로 예상됩니다.그중 정말 성실히 하는 청년도 있겠지만 득보다 실이 많을 것이란 생각이 듭니다.
교통,"사유지라는 말은 배타적 지배를 법으로 인정한 땅 입니다.서울시 ○○구 ○○동 중 일부 땅!! 사유지 위에내 차량만을 위한 주차를 하기 위해 비싼 돈들여 만들어진 주차장이 있습니다.그런데 가끔 전혀 이해관계 없는 사람이 불법으로 점유하여 주차 사용하곤 합니다.저도 이해는 합니다. 워낙에 주차공간 없는 서울이다보니 이런저런 용무로 차량을 빈곳에 주차하는 현실을 말입니다. 바로 10미터 거리에 유료주차장이 있음에도 불구하고 말입니다.서울시에서도 잘 아시겠지만 인터넷 보시면 사유지 불법 주차로 속썩히는 분들 부지기 수입니다. 다세대, 다가구 건물 주차장은 물론 사무실 건물 앞 주차장 등,,다시한 번 말씀드리지만서울특별시에 사유지 불법 주차로 인해 불필요한 스트레스 받고 민원인간에 타툼과 차량 손상등 문제가 너무도 너무도 많이 발생하고 있다는점 다시한 번 말씀드립니다.구청에서도 사유지이다보니 주차하고 7일 이내에는 견인 불가하다경찰에서도 같은 사유로 해줄 수 있는것이 없다민사소송을 하라는데 피해보상 주차비 1만원 나왔다고 소송할 일입니까?현실적으로 말이나 되는 얘기냐 말입니다. 정신적 피해보상 1천만원 나온다면 해볼만 하겠죠,결국은 피해가 발생했을 경우 피해보상 청구 소송 정도가 할 수 있는 전부또는 주차장 사방을 줄로 매서 임의로 치우고 주차시는 제제가 가능하다고 하네요그 나이론 줄이 무슨 LAW 줄인가요?법에서 인정한 사유지 Line 은 무용지물이고 슈퍼에 500원짜리 나이론 끈이 법보다 낳은 가봅니다. 그러면 주차장에 그어놓은 노란페인트 선은 멋으로 그려놓았나요? 나이론 줄 전봇대에 매서 연결해 바닥에 늘어 놓으면 경찰 제제가 가능할까요? 그렇게 놓은 나이론 줄이나 페인트 선이나 뭐가 다르죠?서울시 강남구, 송파구, 등등,,, 정부는 ,,,도대체 언제까지 이 사유지 불법 점유에 대해 방관자가 될 것인가요?사유지,,,, 정부가 배타적 점유를 인정한 곳에 남이 불법 점유하는데말로 치워달라해도 듣지를 않고 배타적 점유를 인정해준 정부한테 도와 달라고 하니 할 수 있는게 없다,,이게 그런거 였다니 참 놀랍습니다.저도 비싼돈 들이지 말고 그냥 남의 주차장에 6일 씩 돌아가며 주차할 것을 그랬나 봅니다. 어찌 생각하면 역으로 정부가, 서울시가 이러한 불법 주차를 인정하고 있는 범위이니까요. 그 불법 주차 일삼는 사람들에게 그렇게 하라고 하는 것이나 다름없지 않는것 아닌가요?이런것을 방조하면 선의의 피해자 양성, 유료주차장 피해, 이들이 똑같이 배워서 또 다른 사유지가서 맘편히 불법 주차를 일삼겠죠,, 이를 방조하는것은 정부이자 서울시 입니다.물에 빠진 조카를 삼촌이 도와 주지 않는 다면 방조,, 살인죄 맞습니다.비유가 지나쳐 보이지만 근본은 동일한 것 같습니다.사유지를 인정하고서 이를 지켜줄 의무가 있는 정부, 서울시가 방조한다면 같은 이치 아닌가 생각합니다.사유지 불법 주차에대한 방안 좀 내 주세요"
주택/도시계획/부동산,@seoul_eds 2억 5천만원 아파트를 매수할때 부동산 수수료율 0.4% 일때 중개수수료 일백만원을 부동산에 지급하게 되는데 그외로 부가가치세도 추가로 부동산업자에게 지급해야 되는지요?
경제/일자리,"○○동 ○○복합몰 인허가 및 ○○복합몰 건설과 관련된 문의드립니다.○○측과 일부상인들간의 합의가 원만하게 이루어지지 않아 ○○복합몰 착공이 어렵게 되자○○측에서 서울시를 상대로 부지 매각 계약 위반으로 소송을 준비하고 있다는 기사를 보았습니다.그렇다면 앞으로 ○○복합몰 착공은 물건너간 것인지 답변을 듣고 싶습니다.그리고 ○○동과 무관한 일부 ○○시장 및 소상공 상인들의 의견을 이유로 지역발전을 위한○○복합몰 건설이 무산되는 것이 과연 마땅한 것인지에 대해 ○○몰 착공을 바라는 지역민의한 사람으로서 매우 화가 납니다.○○측에서 서울시에 소송을 걸고, 부지 매각 계약을 해지하는 수순으로 절차가 이루어지게 된다면○동 랜드마크 부지처럼 또 십수년을 공터로 방치한 채 지역발전도 이루지 못하게 됩니다.이게 진정 지역민을 위하고, 지역발전을 위한 상생의 길인가요?○○복합몰 건설에 대한 답변을 듣고 싶습니다."
환경/공원/상수도,컵라면 용기과일 포장재(코팅된) 일회용 용기색깔있는 스티로폼재활용 시 스티로폼으로 분리배출 하나요? 일반쓰레기인가요?* 민원발생지역을 어디로 설정해야할지 몰라 부득이하게 거주지역으로 설정하였습니다.
환경/공원/상수도,안녕하십니까 경기도 ○○ 거주 소기업체입니다.얼마전에 하이브리드차량을 구매했습니다.공해배출도 없고 통행료도 감면된다고 하여 여러모로 장점이 많아서구매하여 운행하게 되었는데 최근에 남산 1호 터널을 지나다 보니서울시 차량만 통행료가 감면 된다는 규정 때문에 통행료 감면이안된다고 합니다.그래서 다산 콜센터에 문의하여 서울시청 대기 관리과에문의하니 전자태그 발급을 받아야 통행료 감면이 되는데서울시 등록 차량이 아니면 전자태그 발급이 안된다고 합니다.그러면 서울시 등록 차량만 이용하는 도로도 아닌데 서울시이외의등록차량은 차별을 받아야 하는 상황입니다.서울시 등록 차량 이외는 도로를 이용하지 말라는 건지.. 속상합니다.서울시 이외 타지역 등록 차량도 저공해 자동차 혜택인통행료 감면을 받을 수 있도록 조치 바랍니다.
