Subject,Content
기획/감사/교육/정보화/마을공동체,"이번에 난지 야구장 신청을 진행한 사회인 야구단 ○○○입니다.공공체육시설 예약 진행 하는 도중 너무 불합리하다고 느껴지는 부분이 있어 민원 드립니다.한 팀이 동일 날짜 회차에 여러번 신청할 수는 없지만 동일 날짜, 회차에 신청 할 수 있고,또한 여러날에 신청할 수 있도록 되어있습니다.그런데... 여러 날, 여러 회차에 신청하려면 동일한 개인정보를 여러번 반복적으로 입력해야 하는 불편이 있고,이로 인해 불필요한 날짜에까지 예약하거나 누락되는 경우가 생기는 것 같습니다.예약 기준에 따라 보다 편리하게 신청할 수 있도록 개선을 요청드립니다.또한.. 첨부 서류가 한글 파일로 되어 있는데... 한글 파일은 공식적으로 무료로 배포되는 것이 아니니 만큼 다른 수단으로 교체 되었으면 합니다.(일반 메일에 해당 사항을 기재하거나, open office를 사용하는 등의 방안)마직막으로 공지사항 및 예약에 대해 서로 다른 사이트에서 진행되니 혼선도 많은 것 같고 사용자 입장에서 참 불편합니다.시민들에게 제공하는 서비스인 만큼 시민들이 사용하기 편리하고, 시민들이 누구나 부담없이 신청할 수 있도록 제도적인 개선을 요구합니다."
여성/보육/아동 청소년,"서울시 보육포털에서 어린이집 신청 기준은 맞벌이, 다자녀, 편모,편부자녀,기초수급자, 다문화자녀 등 여러 분야의 사회적 약자에 대한 내용이 포함되어 있습니다.하지만 회사 어린이집의 경우 어린이집 신청시 사내 맞벌이, 맞벌이 이 두기준 만으로만운영되고 있습니다.(자회사 이름은 얘기하지 않겠습니다.)회사 어린이집도 외부에서 위탁해서 운영하는 것으로 알고 있고, 이러한 사회적 약자에 대한배려는 필수적이라고 생각됩니다. 사내 어린이집에도 서울시에서 운영하는 기준이동일하게 적용되어야 하는지, 사내 기준만으로 운영되면 되는지에 대해 알려주세요."
안전/소방/민방위,시장님노원 동부간선도로도 빨리 완공해주세요아니면 2차 공사로 지하화도 검토해주세요전오시장 공약할때는 실현불가능이라 생각했는데...너무 막힙니다.의정부에서 몰려오는 차들로 자동차 전용도로기능 상실된지 오래됬습니다.박시장님! 의랏차차 응원하는 상계동 주민
안전/소방/민방위,동부간선도로 터널형 방음벽도 설치해주세요.소음으로 창문을 열어놓지 못합니다.
환경/공원/상수도,"구로구 개웅초교뒤에는 산에 둘러싸여서 바람도 별로없는 체육공원이 있는데 배드민턴코트가3개 유산소운동기구5개가 설치되어 있습니다, 제가 산을 다니다 보니 공원을 이용하는 주민들이 화장실이 없어서 운동하던중 숲속으로 들어간다던가 하는장면을 보게되고 그때문인지 모르지만 숲이 조금씩 더벗겨지는것같은 느낌을 받습니다, 그리고 운동하다가 갈증이 나도 산에 약수가 말라버려 마실물과 씻을물이 없어서 주민들의 이용이 점점 줄어드는것을 보며 주민들의 체력증진을 위해 주민들의 세금으로 조성된 체육공원이 활성화되기를 바라며 화장실을 지어주시기를 바랍니다."
교통,"수고 많으십니다. 다름이 아니라 북악스카이웨이를 경유하는 시내버스 혹은 마을버스 신설을 건의하고자 합니다.북악스카이웨이는 북악산 능선을 따라 자하문에서 정릉 아리랑고개에 이르는 관광도로입니다. 이로 인해 서울시의 주요 드라이브 코스로 정평이 나있고 이 도로를 따라 카페 등 맛집들과 갤러리들이 형성되어 있으며, 많은 사람들이 서울의 야경을 보기 위해 찾고 있습니다. 주요 드라이브 코스로 평이 나있다보니 연인들이 주로 올라가는 편이라고 합니다.인왕스카이웨이도 사직동에서 자하문을 잇는 도로로 북악스카이웨이의 연장선상에 있어서 역시 관광도로 기능을 하고 있구요. 이곳까지 합쳐서 북악스카이웨이로 봐도 무방합니다.그런데 이 유명한 북악스카이웨이를 차를 가지고 있지 않은 사람들은 갈 수 없습니다. 북악스카이웨이를 경유하는 버스가 전혀 없기 때문이죠. 정릉 부근 북악스카이웨이1교에 1162번이 다니긴 하지만 성북구민회관이 끝입니다.물론 인왕스카이웨이와 북악스카이웨이 특성상 승객 물갈이가 전혀 되지 않고, 기점에서 탄 승객들 그대로가 팔각정까지 갈 가능성이 높다고 할 수 있습니다. 그러나 이 노선이 신설될 경우 차 없는 데이트 수요를 흡수할 수 있을 것으로 예상이 되며, 관광 목적으로 입국한 외국인들도 손쉽게 북악스카이웨이에 올라 서울의 야경을 즐길 수 있을 것으로 사료됩니다.게다가 인근에 길상사가 있어 현재 1111번, 2222번을 타고 동방문화대학원대학교에 하차하여 복잡한 골목길을 따라 올라가야 닿을 수 있었던 (이로 인해 외지인들은 한참을 헤매다가 겨우 찾는 불상사가 벌어지기도 합니다) 길상사를 북악골프연습장에서 하차하면 핀란드대사관저를 경유해서 보다 쉽게 도달할 수 있는 장점을 가지고 있습니다.연인들과 관광객들이라는 잠재적 수요가 있을 수 있는 북악스카이웨이와 인왕스카이웨이의 특성상, 인근 수요 최대처인 서울역에서 출발하여 인왕스카이웨이와 가장 가까운 경복궁역을 경유한 뒤 인왕스카이웨이 ~ 북악스카이웨이 ~ 팔각정 ~ 정릉동을 거쳐 성신여대입구에서 회차하도록 하는 것이 바람직할 것이라 생각이 듭니다. 배차간격은 북악스카이웨이로 얼마나 많은 사람들이 대중교통으로 가느냐가 중요하겠지만, 시간에 따라 30 ~ 60분에 1대씩 운행하도록 하는 게 바람직하지 않을까 합니다. 따라서 사람들이 많이 올라가지 않는 낮에는 배차간격을 좀 길게 잡고 야경을 보러가는 사람들이 많아지는 밤에는 약간 짧게 잡는 게 바람직할 것으로 사료됩니다.또한 주로 연인들이 이용할 것으로 예상되는데다 도로 폭이 다소 좁은 이유로 전장 9m급 중형 좌석형 차량 (2x2 배열)을 투입하도록 하는 것이 어떨까 합니다. 또 신설 요청을 하는 노선 특성상 중간에서 내릴 사람들은 많지 않을 것이니 앞문만 있으면 될 거 같구요 (중간문은 필요없다는 말입니다.). 9m급 33인승이면 적절하지 않겠나 생각이 듭니다.본 안건을 긍정적으로 검토하여 반영 부탁드립니다."
건설,"시장님, 저희가 창덕궁 앞에 운영하는 문화공간인 한국문화정품관 앞이 서울시 공사현장의 높은 가림막으로 몇 년째 막혀있어 답답하고 손해가 큽니다.원계획은 백지화되었고 전통문화전시관은 언제 완공될지 알 수 없습니다.관련해서 몇 차례 민원 넣고 시청 유관부서도 찾아뵈었지만 별다른 진전이 없습니다.서울시 소유의 땅에서 사전 검토 충분히 거친 후 진행하는 것에 대해서는 이해합니다만 너무 가깝게 붙어있다보니 저희가 홍보하는데 어려움이 많습니다.공사가림막에 붙인 시트지도 거의 5년동안 광분해되어 흉몰스럽습니다.가림막을 좀 낮춰주시거나 가림막면에 저희가 진행하는 문화행사 홍보라도 할 수 있도록 선처 부탁드립니다.한국다기전,천연염색전,한국차문화전 등을 진행하고 있습니다.wonsoonpark 시장님, 사진도 첨부드립니다. 민원으로도 잘 해결이 안 되어 트윗 드리오니 양해를 부탁드립니다."
건설,"안녕하세요현재 9호선 3단계 공사가 진행중입니다.보훈병원역 근처에 아파트를 소유하고 있는데, 보훈병원역 개통시 정확한 출구위치를 알고 싶습니다.공사장에 출구 표시가 1~5번 출구까지 되어 있던데, 그 위치가 맞는지 궁금합니다.특히 5번 출구는 다른 출구들과 거리가 상당히 떨어져 있던데, 위치가 맞는 건지 알려주세요~5번출구 주변에 출구가 더 생겨서 주변 아파트 단지들의 지하철로의 접근성이 좋아졌으면 하는 바람입니다."
교통,수고하십니다.출근하다가 지하철에서 쓰러지는 임산부는서울지하철 이용하면서 당연한 상황으로 봐야 하는지요?아니면 임신해서 지하철을 이용하는 상황이 잘못 된 것 입니까?저출산 고령화 최저 출산율 고령 산모뉴스에서만 대책이고 떠들고 막상 임산부는 지하철 타면 두려워서배를 움켜 쥐고 손잡이를 꼭 붙들고자리 눈치 보면서 가야 합니까?작년 11월에 임산부 배려석을 분홍색으로 칠하는 방안을 고려 중이사라는데 도대체 고려는 언제 까지 합니까?임부 교실에 광고 하고 싶어서 줄서있는 업체들 많습니다.제발 그 쪽에 연락해서 출산품 육아 업체들은 광고하고 임산부는앉아 갈 수 있는 지하철 타고 싶습니다. !!!!
환경/공원/상수도,마포 하늘공원에 오랜만에 왔더니 노상에 주차를 유료로 전환한다고 하네요....서민들은 공원 즐길 권리도 유료화 하실건가요?TT
교통,@wonsoonpark시장님 가끔 버스들 때문에 신호등이 보이질 않습니다.. 신호가 바뀌었어도 버스가 가리고 있어 바뀐줄도 모르고 마냥 서있던 경우가 있습니다.. 신호등을 버스 높이보다 높이 달아주세요.. http://t.co/xc6JXWqYo9
건강/식품위생,"안녕하십니까?서울시에서도 동물학대& 방치 & 유기하는 사건이 많습니다.신고를 해도 동물이 개인의 재산권이니 어쩌니 하며 행정적으로 처분을 미루거나 나몰라라 하는 구청이 대부분입니다.이유인 즉, 우리에게 강제로 유기동물을 데리고 올 법적인 힘이 없다는 것이지요.그렇게 고통받고, 학대받고, 죽어가는 동물들이 너무 많습니다.이들을 안전하게 보호하고 학대하는 주인에게 벌을 줄 수있는 행정이 마련되길 바랍니다.또한 지금 시에서 동물보호와 학대주인에게 어떤 조치들이 이루어 지고 있는지 궁굼합니다. 답변 주세요~"
환경/공원/상수도,안녕하세요?북서울 꿈의숲에서 가장 낣은 공간이 바로 잔디밭입니다참 보기가 좋지요그런데 그곳은 들어갈수가 없습니다아이들과 부모들이 뛰어놀다가 관리요원분들의 나가라는 소리에 허겁지겁 밖으로 나가야해요그리 넓은공간을 그냥 관상용으로 놔두는것 낭비아닐까요?잔디보호도 좋지만 이용자들이 마음껏 뛰놀수있다면 더 좋지 않을까요?시간제 오픈이나 다른 좋은 방법이 있을것 같은데요좋은 방안을 마련해주십시오감사합니다
기획/감사/교육/정보화/마을공동체,"[건의1]구립도서관 회원증도 시립도서관처럼 2년인간 ~ 2년이후인가 주기적으로 회원 재인증제를 통해구립도서관 회원증도 항시 최신화 시켜주시기를 건의드립니다.[건의2]구립도서관(건의1사항이 이루어질 경우)과 시립도서관 에서 대출증이없어도 모바일 도서앱 으로도 대출증을 대체할 수 있다고 알고 있습니다. 허나 저같이 피쳐폰인 사람이 모바일 도서앱을 설치할 수 없어 난감한상황도 있으므로 저 같은 경우 의견을 내자면 도서관 사이트 회원이면은 회원증이 없어도 책을 빌릴 수 있게 제도 개선 부탁드립니다. 도서관 대출증을 2년 또는 2년이상 이후 주기적으로 update 하기 때문에이 제가 낸 의견이 어느정도는 안정할 거라고 봅니다. 즉, 대출증이 없어도 책을 빌릴 수 있는 제도 개선 부탁드립니다. 단, 대출증을 주기적으로 update 하는 것은 참여해야 하며 최초로 대출증을 안만드는 사람한테는제외된다는 한해서요...끝으로 좋은 하루 되세요 ^^"
교통,롯데월드 정문앞 우측 버스전용차로는 24시간 전일제로 아는데 왜 버스정류장 직전에 택시 정류장을 설치했는지 무슨 생각으로 그위치에 설치했으며 교통흐름을 생각하는사람이라면 있던 택시 정류장이라도 패쇄해야하는거 아닌가요 그택시들 때문에 버스주행흐름에 막대한 영향을 줄뿐아니라 버스앞으로 갑자기 끼어들어 사고유발 시킬수 있다는건 지나가던 시민들도 그냥 아는사실이건만 롯데니까 또 봐주는건지
건강/식품위생,"2월 중순의 일입니다아이가 열이 나긴 했지만 잘 놀아서 큰 걱정없이 일반 감기겠거니 하며 일반 소아과로 갔더니특별한 증상이 없는데(어떤 곳도 염증이 없다고) 열이 계속 나니까 독감 검사를 받아보라고 하더군요검사비가 비싸고 큰 곳이 정확할 거 같아 서남병원으로 갔습니다소아과 선생님이 숨소리를 듣더니 폐렴같다고 엑스레이 찍고 오라고 하시더군요폐사진을 보시더니 폐렴이라고 입원해야 한다고 하시더군요그때 제가 몸이 아파서 입원시킬만한 상황도 아니었고 처음 있는 일이라 깜짝 놀랐습니다오늘 당장 입원해야 하냐고 내일 하면 안되냐고 했더니오늘 입원하면 3일이면 될걸 내일하면 4~5일 해야 될수도 있다고 하시더군요폐렴도 심하지만 않으면 통원 치료도 가능하다고 들었는데응급실가서 검사받고(진료 받던 시간이 오후였기 때문에 소아가 입원할 수 있는 병원 응급실로 가라고 하더군요) 입원시키라고 하니까 정말 심한 상태인가 싶어 걱정에 눈물이 나더군요남편이 일이 많아 도저히 퇴근할 상황이 아니었는데 선생님께서 당장 응급실 가서 입원해야 한다고 했다고 울면서 말하니 눈치보며 퇴근해서 왔습니다응급실로 갔는데 독감일지도 모른다고 해서 독감검사에, 폐사진 다시 찍고, 염증수치 높을수도 있다고 피뽑고, 링거 맞고..이제 6살에 10월생이라 조그만 아이가 그러고 있으니 또 눈물이 나더군요가서 두시간정도 있으니 결과는 독감이랍니다서남병원에서 폐렴이라고 하던데 혹시 폐렴아니냐니까 아니라고 하시더군요많은 시간과 돈을 지불하고 겨우 타미플루 처방받고 돌아왔습니다혹시나 하는 마음에 다음날 서남병원에 같은 선생님께 갔습니다응급실에서 폐렴이 아니라고 했고 제일 처음 갔던 소아과에서도 기관지 소리를 들어봤었는데 별말 없었다고 했는데도 폐렴은 사람마다 다르게 진단할 수도 있다고 다시 봐도 폐렴이라고 하더군요그리고 또 입원하라구요도저히 그 선생님 말을 믿을 수 없어서 아픈 몸을 이끌고 버스 타고 다른 유명한 소아과로 갔더니 그쪽에서도 폐렴 아니라고 하시더군요아니나 다를까 결과적으로는 타미플루 먹기 시작한 다음날 부터 열이 안나고 좋아지더니 곧 나았습니다만약 당장 입원해야 할 정도로 심한 폐렴이었다면 나머지 3군데에서 폐렴이라는 진단을 안내린것도 이상하거니와 설사 그분이 독보적으로 뛰어나서 폐렴인걸 진단하셨다고 해도 타미플루에 항생제류 먹고 금방 나을정도였다면 왜 응급실에 입원까지 권하신건가요???이런게 바로 ""과잉진료"" 겠지요서남병원은 서울시 공공병원인데 어째서 이런 과잉진료를 하는거죠?공공병원은 저렴한 비용에 좋은 진료서비스를 받으라는 목적으로 세워진 곳이 아닌가요?저는 그 당시에 매일매일 아팠고 남편도 저 돌보고 회사 다니느라 지쳐있는 상태였습니다그 상황에서 아이까지 입원해야 한다고 하는데 어느 부모가 마음이 좋겠습니까앞으로 저 선생님이 있는 한 서남병원 소아과는 안갈 것이고 주변과 인터넷으로 이 사실을 알릴겁니다다른 사람도 저처럼 저렴하고 좋은 진료 받는다고 생각하고 갔다가 이런 피해를 당하면 안되니까요후에 지인들에게 이런 사실을 알렸더니 서남병원 의사들 좌천되서 왔다더니 정말인가 보다 라는 소리 들었습니다이런 소문이 났다는건 과잉진료든 의료사고든 빈번하게 일어나고 있다는 증거 아닌가요??서울 시민들을 위해 병원을 지어 주시는것은 고맙지만 질이 이렇게 떨어진다면 누가 안심하고 다니겠습니까의사들 실력이 부족하면 실력을 늘리도록 노력을 하게끔 만들어 주십시요또한 비양심적인 그 소아과 의사에 대한 처리 결과를 저에게 알려주셨으면 하고요"
세금/재정/계약,다름이 아니오라 오늘 저는 황당한 일이 버러진걸 몰랐습니다. 도대체 차량번호판 영치를 해가면서 차주에게 살리지 않는이유가 뭔지영치한다는 종이한장 유리창에 붙여놓고 번호판을 가져기는이유가 뭘까요차주에게 전화한통 해줘야하는거 아닌가요귀찬으니까 무조건 구청으로 오라는건가요국민에 세금으로 급여를 받으시는분들이이렇게 일처리를 하시는 이유가 뭔지?국민을 괴롭히고 피곤하게 하는게 공무원든에 주업무인가요덕분에 저는 오늘 지방도 못가고 손해아니 손해를 봤습니다제가 원하는건차량번호판 영치시 왜 차주에게 통보를 안해주는건지그리고 공무원들 쉬는날이라고 주말에는 문제해결이 안되는 이유일반직장인들은 평일에 시간 내기 힘듭니다따라서 주말에도 문제해결이 가능하도록 방법을 강구해주세요번호판 영치시 차주에게 먼저 전화를 해서 해결하는게 더좋지 않을까요차주에게 통보해주는게 당연한거 아닐까요차주가 창피할까봐 영치증은 왜 뒤집어 놓는것인지전단지 인지알고 버릴뻔 했습니다그런배려라면 전화를 해주는 배려가진짜배려 아니가요귀찬으니 번호판만 가져가고 종이만 적어두면 된다는 행정이 구민을 위한 행정입니까구민에 세금으로 먹고사시는분들의 업무처리방식인가요이건 정말 잘못된 행정이라 생각합니다차라리 전화를 새주셨다면 바로 처리를 했을것이고 공무하시는 분들께 싫은소리를 안하죠구민들의 편의를 생각해주세요제발 부탁드닙니다저같은 피해자가 다시는 안생겼으면합니다유독 은평구청만 이러네요은평구에서 사는게 정말 짜증납니다제가 오늘내일 입을 피해를 생각하니 더 화가납니다제발 바꿔주시기 바랍니다
교통,"강서구의 등촌로 주변보행자도로와 목3,4동 주택가에는 불법주정차가 극심해서 보행자가 거리를 걷는데 상당한 불편을 느낌.제안:서울시에서 공영주차장시설을 대폭 확충하고 단독주택지차량을은 될 수 있는데로 공용주차장과 사설 주차장에 주정차를 하도록 하고 부득이 골목길에 주정차를 할 경우에는 구청에서 허가한 골목길주차구역에 주정차토록 하고 이외 불법주정차를 할 시에는 불법주정차 벌과금을 대폭 올려서 부과토록 하여 불법주정차차량이 한대도 발생하지 않토록 한다.(서울시내 공히 같다고 보아야 함)그리고 차량주정차법규등은 일본의 예를 벤취마킹 할 필요가 있음.일본은 불법주정차가 한대도 발생하지 않음"
주택/도시계획/부동산,"건축물대장상 2001년 9월 17일 일반에서 집합건물로 전환된 이후 2005년 9월 구분등기를 완료한 전환다세대 주택과 관련하여 분양권 및 조합원 자격 여부에 대하여 질의하고자 합니다.1. 서울시 도시 및 주거환경정비조례 부칙 제5조(분양대상기준의 경과조치) 규정 적용시, 분양권에 있어서 전체 구분소유자가 1인의 공동분양 대상이 되는지, 아니면 구분소유자 각각 분양권이 주어지는지 여부2. 전체 구분소유자를 1인의 조합원으로 보는지, 아니면 구분소유자 각각 1인의 조합원에 해당되는지 여부"
환경/공원/상수도,"오늘 어이없는 전단지 한장을 받았습니다.종량제 관련 전단지 내용 중 허!~ 정말 이건 아니다 싶은 내용이 있었습니다. 보는순간 제 눈을 의심했지요. 순가적으로 화가 치밀어 올랐습니다. 내용 일부 (종이류: 사용한 핸드타월.휴지, 각종 영수증 / 폐비닐: 1회용 비닐봉투) 라는 내용은 이성적으로 생각할려해도 열불 납니다. 화장실에서 사용한 휴지를 재활용하라뇨? 더러운 휴지와 여성관련 휴지도 발생하는데~ 거기다 1회용 비닐도 분리하라니~ 화장실 사용 휴지는 민망한 상황이 있을수 있는데 비닐도 못쓰게 하다니~ 영수증은 어떻고요! 개인정보 유출은 본인이 알아서 잘 하라면서 영수증을 분리수거 하라고요?! 아예 대놓고 정보유출 하라는 겁니까? 지금 뭐 하는 것인지요!종량제봉투 값에는 그져 우리가 분리수거하고 쓰레기 담은 봉투만 가져가는 것입니까?단지 쓰레기 봉투만 수거해 가는거라면 봉투값이 정확히 비용이 얼마 들어가는진 모르겠으나 작지 않은 금액이라 생각됩니다. 그리고 문장이 강압적으로 생가됩니다. 캠페인이나 홍보처럼 해야하는것 아닌지요. "" 하라면 해"" 식처럼 받아드려집니다. 오랜시간을 두고 사람들에게 스스로 잘 할수 있도록 좋은쪽으로 안내해야한다고 생각됩니다. 요즘처럼 국민들에게 나라에서 금전적으로 힘들게 하는 시기에 이런 보이지 않는 압력을 행사해야 겠습니까! 어떻게 살란 말입니까! 정말 숨이 막히고 열불 납니다. 어지간히 하십시요. 시간과 노력이 들더라도 오랜 시간을 두고 사람들 스스로 할수 있도록 꾸준히 설득하고 홍보해야한다고 생각됩니다. 사람들이 잘 따르지 않는다고 반 강제적인 느낌이라 너무 화가나서 두서없이 적어봤습니다. 소소하지만 이번처럼 실생활과 밀접한 사항들은 많이 깊게 생가해 주십시요"
환경/공원/상수도,마포구 쓰레기 수거가 월수금 18~24시입니다. 오후에서 새벽까지 일하는 사람은 쓰레기를 버린수도 없습니다. 거기다 재활용기준을 좀더 강하게 한다는 얘기도 있는데 월수금 그시간 외에는 쓰레기를 버릴수도 없게 되어있습니다. 신수동은 재활용통도 없습니다.각 지역별로 아파트처럼 항시 재활용할수있는 공간이 있었으면 합니다. 음식물쓰레기도 규격봉투대신 바로 통으로 넣는게 합리적이지않습니까?동네마다 다 틀리고 정말 불편합니다.
교통,9호선 급행 열차는 5칸 일반 열차는 3칸으로 조정하면 좀 괜찮지 않을까요??일반 열차는 사람이 적더라구요...
교통,존경하는 시장님 택시운송약관을 만들면서 화물적재량이 빠진것 같습니다!승객과 화물적재 때문에 시비가 많습니다!삽입해 주셔요!개인택시 서울시 http://t.co/70949CQOlg
복지/어르신/장애인,시장님 정말 너무하십니다.시청홈페이지에 공개된 공문을 보다가 너무 마음이아파 이렇게 시장님께 트윗까지 하게되었습니다. http://t.co/UxJxg6yYT3보건복지부에서 올해 그동안 경력인정도 받지못하고 소외받고 있던 사회복지 일부종사자들의 처우개선을 위해 지침을 개선해 주었습니다. 그런데 서울시는 그 최소한도 지키려하지 않는다 하니 정말 사회복지종사자로써 대단히 실망스럽습니다.더욱이 올해변경된 건은 그동안 소외받았던 분야입니다. 그래서 더 마음이 아프네요.시장님의 의견을 듣고싶습니다.
건강/식품위생,"안녕하세요^^저는 서울시 광진구에 거주하는 서울시민입니다.저는 이번에 결혼하면서 분가를 하게되어 이사를 하게되었는데,이사를 하게된 건물이 아래 1,2층은 상가인 4층짜리 건물입니다.근데 이사를 오고나서 고민이 생겼습니다.자꾸 사람들이 계단에서 흡연을 하더라구요그런데 금연 기준은 실내에서만 금연법률이 있고계단에서는 흡연을 제재할 법률이 없다고 하더라구요저는 지금 임신중인데다가 조금 있으면 아이가 태어나는데이런 법률 기준이 이해가 가지 않습니다.실내는 금연인데 계단 및 복도는 제재할 기준이 없다는 자체가흡연자들한테 ""실내에서 피지말고 계단에서 피세요"" 밖에 안된다는 겁니다.이 부분을 구청에 요청했는데 시정 방법이 없다고 하는데서울 시청에서도 시정해주실 수 있는 방법이 없는건지요애는 어디서 키워야 하는건지 애가 어려서부터 엄마냄새보다 담배냄새에 절게생겼네요..부탁드립니다..."
